{
  "schema_version": 1,
  "project_id": "life",
  "runtime_control_authority": "NONE",
  "bundle_version": 3,
  "canonical_repository": {
    "repository_id": 1366835183,
    "full_name": "KINETIC-DESIGN-CO/Build",
    "default_branch": "main"
  },
  "required_files": [
    "continuity/bootstrap.json",
    "governance/placement-policy.json",
    "continuity/response-contract.json",
    "continuity/current.json",
    "governance/work-selection-policy.json",
    "governance/issue-lifecycle-policy.json",
    "governance/root-cause-repair-policy.json",
    "governance/root-cause-repairs.json",
    "continuity/checkpoint-policy.json",
    "continuity/checkpoint-template.json",
    "governance/work-admissions.json",
    "continuity/context.md",
    "continuity/decisions.jsonl",
    "continuity/events.jsonl",
    "continuity/directive-ledger.jsonl",
    "continuity/decision-rationale.jsonl",
    "coordination/protocol.json",
    "coordination/README.md",
    "coordination/schema/lock.schema.json",
    "coordination/schema/work-record.schema.json",
    "continuity/schema/bootstrap.schema.json",
    "continuity/schema/current.schema.json",
    "continuity/schema/decision.schema.json",
    "continuity/schema/event.schema.json",
    "continuity/schema/response-contract.schema.json",
    "continuity/schema/checkpoint-policy.schema.json",
    "continuity/schema/checkpoint-template.schema.json",
    "continuity/checkpoint.schema.json",
    "continuity/directive-record.schema.json",
    "continuity/decision-rationale.schema.json",
    "governance/schema/placement-policy.schema.json",
    "governance/schema/work-selection-policy.schema.json",
    "governance/schema/issue-lifecycle-policy.schema.json",
    "governance/schema/root-cause-repair-policy.schema.json",
    "governance/schema/root-cause-repairs.schema.json",
    "governance/schema/work-admissions.schema.json",
    "watchdog/spec.json",
    "watchdog/finding-registry.json",
    "watchdog/schema/spec.schema.json",
    "watchdog/schema/finding-registry.schema.json",
    "scripts/validate_continuity.py",
    "scripts/validate_coordination.py",
    "scripts/validate_lock_history.py",
    "continuity/tools/validate_checkpoints.py",
    "scripts/select_work.py",
    "scripts/validate_issue_lifecycle.py",
    "scripts/validate_root_cause_repair.py",
    "scripts/validate_watchdog.py",
    "tests/test_continuity.py",
    "tests/test_coordination.py",
    "tests/test_lock_history.py",
    "continuity/tests/test_checkpoints.py",
    "tests/test_work_selection.py",
    "tests/test_issue_lifecycle.py",
    "tests/test_root_cause_repair.py",
    "tests/test_watchdog.py",
    ".github/workflows/continuity.yml",
    ".github/workflows/issue-lifecycle.yml"
  ],
  "required_read_order": [
    "continuity/bootstrap.json",
    "governance/placement-policy.json",
    "continuity/response-contract.json",
    "continuity/current.json",
    "governance/work-selection-policy.json",
    "governance/issue-lifecycle-policy.json",
    "governance/root-cause-repair-policy.json",
    "governance/root-cause-repairs.json",
    "continuity/checkpoint-policy.json",
    "continuity/checkpoint-template.json",
    "governance/work-admissions.json",
    "continuity/context.md",
    "continuity/decisions.jsonl",
    "continuity/events.jsonl",
    "continuity/directive-ledger.jsonl",
    "continuity/decision-rationale.jsonl",
    "coordination/protocol.json",
    "coordination/README.md"
  ],
  "resume_algorithm": [
    "READ_REQUIRED_FILES",
    "VALIDATE_BUNDLE",
    "READ_CURRENT_THREAD",
    "READ_LIVE_COORDINATION_FOR_CHECKPOINT_DISCOVERY",
    "READ_LATEST_WORK_CHECKPOINT",
    "READ_CHECKPOINT_PROVENANCE",
    "RUN_REQUIRED_FRESH_RESEARCH",
    "READ_AUTHORIZED_SYSTEMS",
    "VERIFY_REFERENCED_LIVE_OBJECTS",
    "MARK_STALE_OR_MISMATCHED_STATE_NOT_RUN",
    "APPLY_LATER_VINCE_CORRECTIONS",
    "EVALUATE_WORK_SELECTION",
    "CONTINUE_FROM_NEXT_ACTION"
  ],
  "continuity_update_event_types": [
    "VINCE_DIRECTIVE",
    "ARCHITECTURE_DECISION",
    "GITHUB_MUTATION",
    "SUPABASE_MUTATION",
    "VERCEL_MUTATION",
    "PROJECT_INSTRUCTION_CHANGE",
    "VERIFICATION_TRANSITION",
    "BLOCKER_TRANSITION",
    "NEXT_ACTION_CHANGE",
    "COMPONENT_TRANSITION"
  ],
  "continuity_sync_paths": [
    "continuity/**",
    "coordination/work/**",
    "scripts/validate_continuity.py",
    "tests/test_continuity.py",
    ".github/workflows/continuity.yml"
  ],
  "continuity_sync_rule": "A repository mutation whose changed paths are a nonempty subset of continuity_sync_paths is CONTINUITY_SYNC and does not require a second continuity update solely because that continuity mutation occurred, including a pull-request merge to main. A GitHub mutation whose target branch matches work/<lowercase-UUIDv4> or lock/<64-lowercase-hex> and does not update main is SOURCE_WORKSPACE_MUTATION and does not require continuity synchronization solely because it occurred; that branch's Git history and live machine state are its exact evidence. Creation of the work branch from current main is included. Any update to main whose changed paths are not a nonempty subset of continuity_sync_paths is never exempt. Git history remains the exact byte-history for every exempt mutation.",
  "validation_command": "python scripts/validate_continuity.py && python scripts/validate_coordination.py && python scripts/validate_lock_history.py && python continuity/tools/validate_checkpoints.py && python continuity/tests/test_checkpoints.py && python scripts/select_work.py --validate-policy && python scripts/validate_issue_lifecycle.py --validate-policy && python scripts/validate_root_cause_repair.py && python scripts/validate_watchdog.py && python -m unittest discover -s tests -p 'test_*.py'"
}
